{
  "$schema": "https://json-schema.org/draft/2020-12/schema",
  "$id": "https://livingfeed.dev/schemas/events/envelope.schema.json",
  "title": "EventEnvelope",
  "description": "모든 Living Feed 도메인 이벤트의 공통 봉투 (ADR-002)",
  "type": "object",
  "properties": {
    "event_id": {
      "type": "string",
      "description": "ULID — 시간순 정렬 가능",
      "pattern": "^[0-9A-HJKMNP-TV-Z]{26}$"
    },
    "stream": {
      "type": "string",
      "enum": ["actor", "world", "relationship", "feed", "player", "system"]
    },
    "type": {
      "type": "string",
      "description": "<stream>.<entity>.<past-tense-verb>",
      "pattern": "^[a-z_]+(\\.[a-z_]+){2,}$"
    },
    "schema_version": {
      "type": "integer",
      "minimum": 1,
      "default": 1
    },
    "world_id": {
      "type": "string",
      "pattern": "^w_[a-z0-9_]+$"
    },
    "actor_id": {
      "type": ["string", "null"],
      "description": "주체 액터 (없으면 null)"
    },
    "tick": {
      "type": "integer",
      "minimum": 0,
      "description": "발생 시점의 세계 tick (ADR-011)"
    },
    "occurred_at": {
      "type": "string",
      "format": "date-time"
    },
    "causation_id": {
      "type": ["string", "null"],
      "description": "이 이벤트를 유발한 직전 이벤트의 event_id (체인 시작이면 null)"
    },
    "correlation_id": {
      "type": "string",
      "description": "하나의 서사적 사건 단위 — 드라마 추적용 (ADR-013)"
    },
    "provenance": {
      "$ref": "#/$defs/provenance"
    },
    "payload": {
      "type": "object",
      "description": "타입별 payload — events/<type>.schema.json 으로 검증"
    }
  },
  "required": [
    "event_id",
    "stream",
    "type",
    "schema_version",
    "world_id",
    "actor_id",
    "tick",
    "occurred_at",
    "causation_id",
    "correlation_id",
    "provenance",
    "payload"
  ],
  "additionalProperties": false,
  "$defs": {
    "provenance": {
      "title": "Provenance",
      "description": "출처 등급 — 이 이벤트의 내용이 어디서 왔는가 (ADR-021 §1). 이 구분이 없으면 '인물이 기억한 것'과 'LLM이 방금 지어낸 것'이 같은 통에 담겨 창발 주장이 검증 불가능해진다. 등급마다 근거 필드가 필수이며, 근거를 대지 못하는 이벤트는 append가 거부한다.\n\n등급별 변형을 oneOf로 나눈 것은 두 가지를 동시에 얻기 위해서다: 런타임 검증은 각 변형의 required가 집행하고, 코드젠(Python/TypeScript)은 이 구조를 판별 유니온으로 옮긴다 — 하나의 객체에 if/then을 얹으면 json2ls·datamodel-code-generator가 조건을 버려 '아무 키나 허용'하는 타입이 나온다. 소비자가 kind로 좁히면 근거 필드가 타입으로 따라오는 것이 목적이다.",
      "oneOf": [
        {
          "type": "object",
          "title": "Recalled",
          "description": "기존 사건에서 인출된 사실 — 근거 사건이 반드시 있다.",
          "properties": {
            "kind": { "const": "recalled" },
            "source_event_ids": {
              "type": "array",
              "description": "이 내용이 인출된 근거 사건들. 비어 있으면 '기억'이라 부를 수 없다.",
              "items": { "type": "string", "pattern": "^[0-9A-HJKMNP-TV-Z]{26}$" },
              "minItems": 1
            }
          },
          "required": ["kind", "source_event_ids"],
          "additionalProperties": false
        },
        {
          "type": "object",
          "title": "Derived",
          "description": "규칙에서 결정적으로 파생 — rule_id가 L2 규칙 재실행의 진입점이다 (ADR-021 §4).",
          "properties": {
            "kind": { "const": "derived" },
            "rule_id": {
              "type": "string",
              "description": "이 내용을 파생시킨 규칙 식별자 (예: emotion.appraise)",
              "minLength": 1,
              "maxLength": 120
            }
          },
          "required": ["kind", "rule_id"],
          "additionalProperties": false
        },
        {
          "type": "object",
          "title": "Generated",
          "description": "LLM이 이번 호출에서 생성한 해석 — 재현 보증이 없다 (ADR-021 §4 L3).",
          "properties": {
            "kind": { "const": "generated" },
            "trace_id": {
              "type": "string",
              "description": "이 내용을 생성한 LLM 호출의 ContextBundle trace_id (ADR-009/018). 결정 기록과 이벤트를 잇는 유일한 고리다. ULID 패턴을 강제하지 않는다: 액터는 new_ulid()를, Director는 결정적 합성 id(director-<world>-<tick>)를 쓰며, actor.action.performed의 decision_trace.trace_id도 패턴 없는 문자열이다 — 여기서만 좁히면 같은 값이 한쪽에서만 통과한다.",
              "minLength": 1,
              "maxLength": 120
            }
          },
          "required": ["kind", "trace_id"],
          "additionalProperties": false
        },
        {
          "type": "object",
          "title": "Authored",
          "description": "사람이 저작 — 스튜디오 페르소나, 플레이어 개입, 시드 저작물.",
          "properties": {
            "kind": { "const": "authored" },
            "author_id": {
              "type": "string",
              "description": "저작한 사람 (플레이어 id, 스튜디오 사용자, 시드 저작자). 사람이 쓴 것과 LLM이 지어낸 것이 섞이면 창발 주장의 가장 흔한 오염원이 된다.",
              "minLength": 1,
              "maxLength": 120
            }
          },
          "required": ["kind", "author_id"],
          "additionalProperties": false
        },
        {
          "type": "object",
          "title": "UnknownProvenance",
          "description": "출처 미상 — ADR-021 이전 적재분에만 존재하는 읽기 전용 값이다. 쓰기 경로(store._validate)가 거부한다. 근거 필드가 없는 것이 이 등급의 정의다: 모른다는 사실 자체를 기록한다.",
          "properties": { "kind": { "const": "unknown" } },
          "required": ["kind"],
          "additionalProperties": false
        }
      ]
    }
  }
}
