{
  "event_id": "01JZK7Q3W0000000000000000K",
  "stream": "actor",
  "type": "actor.message.sent",
  "schema_version": 1,
  "world_id": "w_main",
  "actor_id": "a_aria_kim",
  "tick": 44,
  "occurred_at": "2026-07-11T09:02:05Z",
  "causation_id": "01JZK7Q3W0000000000000000G",
  "correlation_id": "01JZK7Q3W0000000000000000G",
  "provenance": {
    "kind": "generated",
    "trace_id": "01JZK7Q3W0000000000000000C"
  },
  "payload": {
    "channel": "dm",
    "target_player_id": "p_observer_0417",
    "text": "고마워요. 사실 아무한테도 말 못 하고 있었거든요. 오늘은 조금 힘이 나요.",
    "post_id": null,
    "in_reply_to": "01JZK7Q3W0000000000000000G"
  }
}
