{
  "event_id": "01JZK7Q3W0000000000000000D",
  "stream": "system",
  "type": "system.tick.completed",
  "schema_version": 1,
  "world_id": "w_main",
  "actor_id": null,
  "tick": 42,
  "occurred_at": "2026-07-11T09:01:00Z",
  "causation_id": "01JZK7Q3W0000000000000000A",
  "correlation_id": "01JZK7Q3W0000000000000000E",
  "provenance": {
    "kind": "derived",
    "rule_id": "tick.pipeline:completed"
  },
  "payload": {
    "tick": 42,
    "started_at": "2026-07-11T09:00:00Z",
    "completed_at": "2026-07-11T09:00:41Z",
    "duration_ms": 41000,
    "actors_decided": {
      "hot": 12,
      "warm": 30,
      "cold": 58
    },
    "events_emitted": 87
  }
}
