{
  "event_id": "01JZK7Q3W0000000000000000F",
  "stream": "system",
  "type": "system.tick.started",
  "schema_version": 1,
  "world_id": "w_main",
  "actor_id": null,
  "tick": 42,
  "occurred_at": "2026-07-11T09:00:00Z",
  "causation_id": null,
  "correlation_id": "01JZK7Q3W0000000000000000G",
  "provenance": {
    "kind": "derived",
    "rule_id": "tick.pipeline:started"
  },
  "payload": {
    "tick": 42,
    "started_at": "2026-07-11T09:00:00Z",
    "scheduled": {
      "hot": 12,
      "warm": 30,
      "cold": 58
    }
  }
}
